{"difficultyMultipliers":{"EASY":1,"MID":1.2,"HARD":1.5,"ELITE":2},"pricingCurves":{"hardware":[100,200],"toolBase":50,"versionBoostBase":0.12},"upgradeCostScaling":1.15,"payoutBalancing":{"earlyGameFactor":1,"lateGameFactor":1.3},"toolVersionPerformanceIncrement":0.12,"reputationDiscountFactors":{"trusted":0.05,"allied":0.1},"decayStep":2,"traceBaseRatesByDifficulty":{"EASY":1,"MID":2,"HARD":3,"ELITE":4},"version":1}